{
  "apiVersion": 1,
  "title": "CHO-DARI-",
  "artist": "四时小路Komichi",
  "lines": [
    {
      "start": 13.723,
      "end": 16.273,
      "text": "ヤリタカネー ヤリタカネー"
    },
    {
      "start": 16.273,
      "end": 19.69,
      "text": "楽しいを蹴って得る はした金"
    },
    {
      "start": 19.69,
      "end": 21.963,
      "text": "スグカセゲー スグカセゲー"
    },
    {
      "start": 21.963,
      "end": 23.866,
      "text": "そんな事なんかより"
    },
    {
      "start": 23.866,
      "end": 25.305,
      "text": "WHAT A LUCKY DAY！"
    },
    {
      "start": 25.305,
      "end": 28.346,
      "text": "そろそろ真面目にやれって提案も"
    },
    {
      "start": 28.346,
      "end": 31.344,
      "text": "このお日様には敵わねーな"
    },
    {
      "start": 31.344,
      "end": 34.203,
      "text": "時に迷惑お掛けしています"
    },
    {
      "start": 34.203,
      "end": 35.657,
      "text": "いまだ無計画"
    },
    {
      "start": 35.657,
      "end": 37.489,
      "text": "でも ソーユー性格"
    },
    {
      "start": 37.489,
      "end": 40.798,
      "text": "アイコン 気にしちゃいないし"
    },
    {
      "start": 40.798,
      "end": 43.452,
      "text": "リスぺクト 無いライン要らんし"
    },
    {
      "start": 43.452,
      "end": 44.796,
      "text": "バカ話で花咲かして"
    },
    {
      "start": 44.796,
      "end": 47.897,
      "text": "ビジシネス退勤 目先のマニーより"
    },
    {
      "start": 47.897,
      "end": 48.951,
      "text": "気持ち良いのが大事！"
    },
    {
      "start": 48.951,
      "end": 50.257,
      "text": "CHO CHO CHO チョーダリー"
    },
    {
      "start": 50.257,
      "end": 51.719,
      "text": "MON MON MON 問題"
    },
    {
      "start": 51.719,
      "end": 54.695,
      "text": "堂々と問答の本性をソッコー 頂戴"
    },
    {
      "start": 54.695,
      "end": 56.298,
      "text": "CO CO CO 後悔"
    },
    {
      "start": 56.298,
      "end": 57.853,
      "text": "HO HO HO 頬張り"
    },
    {
      "start": 57.853,
      "end": 60.706,
      "text": "上々な音響の放送で脳も 爽快"
    },
    {
      "start": 60.706,
      "end": 62.189,
      "text": "CHO CHO CHO チョーダリー"
    },
    {
      "start": 62.189,
      "end": 63.85,
      "text": "MON MON MON 問題"
    },
    {
      "start": 63.85,
      "end": 66.858,
      "text": "堂々と問答の本性をソッコー 頂戴"
    },
    {
      "start": 66.858,
      "end": 68.349,
      "text": "SHO SHO SHO 商売"
    },
    {
      "start": 68.349,
      "end": 69.831,
      "text": "HO HO HO 崩壊"
    },
    {
      "start": 69.831,
      "end": 73.334,
      "text": "轟音の暴走で大物も呆然 総立ち"
    },
    {
      "start": 73.334,
      "end": 76.757,
      "text": "とﾞどうかこうかして得るfavor"
    },
    {
      "start": 76.757,
      "end": 79.562,
      "text": "高っけぇブランドグくらい興味ねぃわ"
    },
    {
      "start": 79.562,
      "end": 82.756,
      "text": "バーゲンプライスの世辞じゃ贅沢"
    },
    {
      "start": 82.756,
      "end": 86.0,
      "text": "出来ないし"
    },
    {
      "start": 86.0,
      "end": 87.558,
      "text": "いつもいつも肩に力入れてても"
    },
    {
      "start": 87.558,
      "end": 88.532,
      "text": "イマイチ"
    },
    {
      "start": 88.532,
      "end": 90.595,
      "text": "たまに言う生意気な事も"
    },
    {
      "start": 90.595,
      "end": 91.627,
      "text": "i’m lovin’ it"
    },
    {
      "start": 91.627,
      "end": 94.294,
      "text": "無理やりなやる気すぐ廃棄"
    },
    {
      "start": 94.294,
      "end": 96.621,
      "text": "半歩位で Busy Busy より"
    },
    {
      "start": 96.621,
      "end": 97.805,
      "text": "Easy Easy Go"
    },
    {
      "start": 97.805,
      "end": 99.187,
      "text": "やりたい事なら沢山"
    },
    {
      "start": 99.187,
      "end": 100.731,
      "text": "でっかい夢見る毎晩"
    },
    {
      "start": 100.731,
      "end": 102.227,
      "text": "道から一歩位は"
    },
    {
      "start": 102.227,
      "end": 103.814,
      "text": "たまに外してみたいじゃん？"
    },
    {
      "start": 103.814,
      "end": 104.939,
      "text": "Having a good time?"
    },
    {
      "start": 104.939,
      "end": 106.884,
      "text": "Having a good time?"
    },
    {
      "start": 106.884,
      "end": 107.944,
      "text": "あれもこれもどれもそれも全部"
    },
    {
      "start": 107.944,
      "end": 108.953,
      "text": "遊んでなんぼでしょ！"
    },
    {
      "start": 108.953,
      "end": 110.269,
      "text": "CHO CHO CHO チョーダリー"
    },
    {
      "start": 110.269,
      "end": 111.726,
      "text": "MON MON MON 問題"
    },
    {
      "start": 111.726,
      "end": 114.746,
      "text": "堂々と問答の本性をソッコー 頂戴"
    },
    {
      "start": 114.746,
      "end": 116.247,
      "text": "CO CO CO 後悔"
    },
    {
      "start": 116.247,
      "end": 117.849,
      "text": "HO HO HO 頬張り"
    },
    {
      "start": 117.849,
      "end": 120.768,
      "text": "上々な音響の放送で脳も 爽快"
    },
    {
      "start": 120.768,
      "end": 122.26,
      "text": "CHO CHO CHO チョーダリー"
    },
    {
      "start": 122.26,
      "end": 123.779,
      "text": "MON MON MON 問題"
    },
    {
      "start": 123.779,
      "end": 126.737,
      "text": "堂々と問答の本性をソッコー 頂戴"
    },
    {
      "start": 126.737,
      "end": 128.225,
      "text": "SHO SHO SHO 商売"
    },
    {
      "start": 128.225,
      "end": 129.86,
      "text": "HO HO HO 崩壊"
    },
    {
      "start": 129.86,
      "end": 134.864,
      "text": "轟音の暴走で大物も呆然 総立ち"
    },
    {
      "start": 138.736,
      "end": 145.038,
      "text": "CHO CHO CHO CHO-DARI-"
    },
    {
      "start": 145.038,
      "end": 150.965,
      "text": "CHO CHO CHO CHO CHO-DARI-"
    },
    {
      "start": 150.965,
      "end": 152.299,
      "text": "CHO CHO CHO CHO CHO-DARI-"
    },
    {
      "start": 152.299,
      "end": 155.037,
      "text": "MON MON MON MON MONDAI"
    }
  ]
}
